{
  "authorized_roles": [
    "official_kernel_checker"
  ],
  "credential_id": "xlnodecred:blake3:c94fe9ad1621454c06fc70f3779479fc04ece86ec3bcf9d0d27f8996e1f2b95e",
  "evidence_root": "blake3:a-node-evidence-root",
  "expires_at": "2027-09-01T00:00:00Z",
  "hardware_attestation_root": null,
  "issued_at": "2026-09-01T00:00:00Z",
  "node_id": "xlnode:blake3:aaaaaaaaaaaaaaaaaaaaaaaaaaaaaaaaaaaaaaaaaaaaaaaaaaaaaaaaaaaaaaaa",
  "node_public_key": "did:key:checker-node-a",
  "operator_cluster_id": "xloperator:blake3:dddddddddddddddddddddddddddddddddddddddddddddddddddddddddddddddd",
  "operator_credential_id": "xloperatorcred:blake3:33a8631e123761e53abb02af549f534eb57fbb948013d3fd437d8e425c38dc09",
  "operator_delegation_signature": "example-node-delegation-signature-a",
  "operator_id": "xlop:blake3:e7e8b7222bc5e3d3781ab251f5cf130fd879d9478162b65d012007deeb7c2e3b"
}
